{
  "events": [
    {
      "ch": "chMetabolicScore",
      "ctx": "Add(-0.15)>>Sign",
      "expected_obj": "AFFIRM",
      "kappa_loc": 0.0,
      "obj": "NEGATE",
      "r_eff": -1.0,
      "r_raw": 0.1,
      "s": 0.1,
      "step": 1,
      "t": 1.0
    }
  ],
  "program_file": "programs/biomed_v1/metabolic_risk.sc",
  "schema": "semiocore.trace.v1",
  "summary": {
    "N": 1,
    "deltaT": 1.0,
    "kappa": 0.0,
    "rho": 1.0
  }
}
