{
  "events": [
    {
      "ch": "chFrailtyScore",
      "ctx": "Add(-0.05)>>Sign",
      "expected_obj": "AFFIRM",
      "kappa_loc": 0.0,
      "obj": "NEGATE",
      "r_eff": -1.0,
      "r_raw": 0.05,
      "s": 0.05,
      "step": 1,
      "t": 1.0
    }
  ],
  "program_file": "C:\\Users\\israe\\Documents\\GitHub\\semiocore-v1\\programs\\biomed_v1\\frailty_phenotype.sc",
  "schema": "semiocore.trace.v1",
  "summary": {
    "N": 1,
    "deltaT": 1.0,
    "kappa": 0.0,
    "rho": 1.0
  }
}
